{
  "$schema": "https://json-schema.org/draft/2020-12/schema",
  "$id": "https://interview.local/protocol/v1/envelope.schema.json",
  "title": "Interview sidecar Protocol V1 envelope",
  "type": "object",
  "additionalProperties": false,
  "required": [
    "version",
    "id",
    "session_id",
    "sequence",
    "timestamp_ms",
    "kind",
    "payload",
    "correlation_id"
  ],
  "properties": {
    "version": { "type": "integer", "minimum": 0, "maximum": 65535, "const": 1 },
    "id": { "$ref": "#/$defs/uuid" },
    "session_id": { "anyOf": [{ "$ref": "#/$defs/uuid" }, { "type": "null" }] },
    "sequence": { "type": "integer", "minimum": 0, "maximum": 9007199254740991 },
    "timestamp_ms": { "type": "integer", "minimum": 0, "maximum": 9007199254740991 },
    "kind": {
      "enum": [
        "handshake.request",
        "session.start",
        "session.stop",
        "listening.set",
        "you_source.set",
        "query.trigger",
        "audio.system.set",
        "audio.device.set",
        "knowledge.ingest",
        "session.snapshot.request",
        "sidecar.ready",
        "session.state",
        "transcript.updated",
        "suggestion.chunk",
        "suggestion.completed",
        "audio.health",
        "provider.health",
        "knowledge.state",
        "runtime.error"
      ]
    },
    "payload": { "type": "object", "additionalProperties": true },
    "correlation_id": { "anyOf": [{ "$ref": "#/$defs/uuid" }, { "type": "null" }] }
  },
  "$defs": {
    "uuid": {
      "type": "string",
      "format": "uuid",
      "pattern": "^[0-9a-fA-F]{8}-[0-9a-fA-F]{4}-[0-9a-fA-F]{4}-[0-9a-fA-F]{4}-[0-9a-fA-F]{12}$"
    }
  }
}
